Server [localhost]:
Database [postgres]:
Port [5432]:
Username [postgres]:
Password for user postgres:

psql (17.5)
WARNING: Console code page (437) differs from Windows code page (1252)
         8-bit characters might not work correctly. See psql reference
         page "Notes for Windows users" for details.
Type "help" for help.

postgres=# \c tcadb16;
You are now connected to database "tcadb16" as user "postgres".
tcadb16=# select * from student;
 rno | name | per |    grade
-----+------+-----+-------------
 101 | AAA  |  60 | First Class
 102 | BBB  |  80 | DISTINCTION
 103 | CCC  |  20 | Fail
 104 | DDD  |  38 | Fail
 105 | EEE  |  42 | Pass
 107 | FFF  |  65 | First Class
 109 | PPP  |  88 | DISTINCTION
(7 rows)


tcadb16=# ALTER TABLE student DROP COLUMN grade;
ALTER TABLE
tcadb16=# select * from student;
 rno | name | per
-----+------+-----
 101 | AAA  |  60
 102 | BBB  |  80
 103 | CCC  |  20
 104 | DDD  |  38
 105 | EEE  |  42
 107 | FFF  |  65
 109 | PPP  |  88
(7 rows)


tcadb16=# ALTER TABLE student DELETE COLUMN where rno = 109;
ERROR:  syntax error at or near "DELETE"
LINE 1: ALTER TABLE student DELETE COLUMN where rno = 109;
                            ^
tcadb16=# ALTER student DELETE COLUMN where rno = 109;
ERROR:  syntax error at or near "student"
LINE 1: ALTER student DELETE COLUMN where rno = 109;
              ^
tcadb16=# ALTER table DELETE COLUMN where rno = 109;
ERROR:  syntax error at or near "COLUMN"
LINE 1: ALTER table DELETE COLUMN where rno = 109;
                           ^
tcadb16=# DELETE FROM student WHERE rno = 109;
DELETE 1
tcadb16=# select * from student;
 rno | name | per
-----+------+-----
 101 | AAA  |  60
 102 | BBB  |  80
 103 | CCC  |  20
 104 | DDD  |  38
 105 | EEE  |  42
 107 | FFF  |  65
(6 rows)


tcadb16=#