Server [localhost]:
Database [postgres]:
Port [5432]:
Username [postgres]:
Password for user postgres:

psql (17.5)
WARNING: Console code page (437) differs from Windows code page (1252)
         8-bit characters might not work correctly. See psql reference
         page "Notes for Windows users" for details.
Type "help" for help.

postgres=# \c tcadb16;
You are now connected to database "tcadb16" as user "postgres".
tcadb16=# select * from student;
 rno | name | per |   city
-----+------+-----+----------
   1 | AAA  |  70 | PUNE
   2 | BBB  |  29 | PANJI
   3 | CCC  |  50 | MUMBAI
   4 | DDD  |  64 | DELHI
   5 | EEE  |  87 | BANGLORE
   6 | FFF  |  95 | PUNE
   7 | GGG  |  55 | PUNE
   8 | BBB  |  73 | DELHI
   9 | HHH  |     | PUNE
(9 rows)


tcadb16=# CREATE TABLE student(
tcadb16(#     rno int primary key,
tcadb16(#     name varchar(10),
tcadb16(#     per float,
tcadb16(#     city varchar(20)
tcadb16(#  );
ERROR:  relation "student" already exists
tcadb16=# insert into student values(1,'AAA',70,'PUNE');
ERROR:  duplicate key value violates unique constraint "student_pkey"
DETAIL:  Key (rno)=(1) already exists.
tcadb16=# insert into student values(2,'BBB',29,'PANJI');
ERROR:  duplicate key value violates unique constraint "student_pkey"
DETAIL:  Key (rno)=(2) already exists.
tcadb16=# insert into student values(3,'CCC',50,'MUMBAI');
ERROR:  duplicate key value violates unique constraint "student_pkey"
DETAIL:  Key (rno)=(3) already exists.
tcadb16=# insert into student values(4,'DDD',64,'DELHI');
ERROR:  duplicate key value violates unique constraint "student_pkey"
DETAIL:  Key (rno)=(4) already exists.
tcadb16=# insert into student values(5,'EEE',87,'BANGLORE');
ERROR:  duplicate key value violates unique constraint "student_pkey"
DETAIL:  Key (rno)=(5) already exists.
tcadb16=# insert into student values(6,'FFF',95,'PUNE');
ERROR:  duplicate key value violates unique constraint "student_pkey"
DETAIL:  Key (rno)=(6) already exists.
tcadb16=# insert into student values(7,'GGG',45,'PUNE');
ERROR:  duplicate key value violates unique constraint "student_pkey"
DETAIL:  Key (rno)=(7) already exists.
tcadb16=# insert into student values(8,'BBB',73,'DELHI');
ERROR:  duplicate key value violates unique constraint "student_pkey"
DETAIL:  Key (rno)=(8) already exists.
tcadb16=# drop table student;
DROP TABLE
tcadb16=# insert into student values(7,'GGG',45,'PUNE'); CREATE TABLE student(
ERROR:  relation "student" does not exist
LINE 1: insert into student values(7,'GGG',45,'PUNE');
                    ^
tcadb16(#     rno int primary key,
tcadb16(#     name varchar(10),
tcadb16(#     per float,
tcadb16(#     city varchar(20)
tcadb16(#  );
CREATE TABLE
tcadb16=# insert into student values(1,'AAA',70,'PUNE');
INSERT 0 1
tcadb16=# insert into student values(2,'BBB',29,'PANJI');
INSERT 0 1
tcadb16=# insert into student values(3,'CCC',50,'MUMBAI');
INSERT 0 1
tcadb16=# insert into student values(4,'DDD',64,'DELHI');
INSERT 0 1
tcadb16=# insert into student values(5,'EEE',87,'BANGLORE');
INSERT 0 1
tcadb16=# insert into student values(6,'FFF',95,'PUNE');
INSERT 0 1
tcadb16=# insert into student values(7,'GGG',45,'PUNE');
INSERT 0 1
tcadb16=# insert into student values(8,'BBB',73,'DELHI');
INSERT 0 1
tcadb16=# select * from studetn;
ERROR:  relation "studetn" does not exist
LINE 1: select * from studetn;
                      ^
tcadb16=# select * from student;
 rno | name | per |   city
-----+------+-----+----------
   1 | AAA  |  70 | PUNE
   2 | BBB  |  29 | PANJI
   3 | CCC  |  50 | MUMBAI
   4 | DDD  |  64 | DELHI
   5 | EEE  |  87 | BANGLORE
   6 | FFF  |  95 | PUNE
   7 | GGG  |  45 | PUNE
   8 | BBB  |  73 | DELHI
(8 rows)


tcadb16=# update student set per=43,city ='PUNE' where rno=3'
tcadb16'# update student set per=43,city ='PUNE' where rno=3;
tcadb16'# cd..
tcadb16'# sdead
tcadb16'# up


Server [localhost]:
Database [postgres]:
Port [5432]:
Username [postgres]:
Password for user postgres:

psql (17.5)
WARNING: Console code page (437) differs from Windows code page (1252)
         8-bit characters might not work correctly. See psql reference
         page "Notes for Windows users" for details.
Type "help" for help.

postgres=# \c tcadb16;
You are now connected to database "tcadb16" as user "postgres".
tcadb16=# select * from student;
 rno | name | per |   city
-----+------+-----+----------
   1 | AAA  |  70 | PUNE
   2 | BBB  |  29 | PANJI
   3 | CCC  |  50 | MUMBAI
   4 | DDD  |  64 | DELHI
   5 | EEE  |  87 | BANGLORE
   6 | FFF  |  95 | PUNE
   7 | GGG  |  45 | PUNE
   8 | BBB  |  73 | DELHI
(8 rows)


tcadb16=# update student set per=43, city='PUNE' where rno=3;
UPDATE 1
tcadb16=# select * from student;
 rno | name | per |   city
-----+------+-----+----------
   1 | AAA  |  70 | PUNE
   2 | BBB  |  29 | PANJI
   4 | DDD  |  64 | DELHI
   5 | EEE  |  87 | BANGLORE
   6 | FFF  |  95 | PUNE
   7 | GGG  |  45 | PUNE
   8 | BBB  |  73 | DELHI
   3 | CCC  |  43 | PUNE
(8 rows)


tcadb16=# select * from student ORDER BY rno;
 rno | name | per |   city
-----+------+-----+----------
   1 | AAA  |  70 | PUNE
   2 | BBB  |  29 | PANJI
   3 | CCC  |  43 | PUNE
   4 | DDD  |  64 | DELHI
   5 | EEE  |  87 | BANGLORE
   6 | FFF  |  95 | PUNE
   7 | GGG  |  45 | PUNE
   8 | BBB  |  73 | DELHI
(8 rows)


tcadb16=# select * from student ORDER BY rno DESC;
 rno | name | per |   city
-----+------+-----+----------
   8 | BBB  |  73 | DELHI
   7 | GGG  |  45 | PUNE
   6 | FFF  |  95 | PUNE
   5 | EEE  |  87 | BANGLORE
   4 | DDD  |  64 | DELHI
   3 | CCC  |  43 | PUNE
   2 | BBB  |  29 | PANJI
   1 | AAA  |  70 | PUNE
(8 rows)


tcadb16=# update student set per=43, city='PUNE';
UPDATE 8
tcadb16=# select * from student;
 rno | name | per | city
-----+------+-----+------
   1 | AAA  |  43 | PUNE
   2 | BBB  |  43 | PUNE
   4 | DDD  |  43 | PUNE
   5 | EEE  |  43 | PUNE
   6 | FFF  |  43 | PUNE
   7 | GGG  |  43 | PUNE
   8 | BBB  |  43 | PUNE
   3 | CCC  |  43 | PUNE
(8 rows)


tcadb16=# update student set per=43, city='MUMBAI' where rno=9;
UPDATE 0
tcadb16=# select * from student;
 rno | name | per | city
-----+------+-----+------
   1 | AAA  |  43 | PUNE
   2 | BBB  |  43 | PUNE
   4 | DDD  |  43 | PUNE
   5 | EEE  |  43 | PUNE
   6 | FFF  |  43 | PUNE
   7 | GGG  |  43 | PUNE
   8 | BBB  |  43 | PUNE
   3 | CCC  |  43 | PUNE
(8 rows)


tcadb16=# update student set per=87 WHERE rno=2;
UPDATE 1
tcadb16=# select * from student;
 rno | name | per | city
-----+------+-----+------
   1 | AAA  |  43 | PUNE
   4 | DDD  |  43 | PUNE
   5 | EEE  |  43 | PUNE
   6 | FFF  |  43 | PUNE
   7 | GGG  |  43 | PUNE
   8 | BBB  |  43 | PUNE
   3 | CCC  |  43 | PUNE
   2 | BBB  |  87 | PUNE
(8 rows)


tcadb16=# update student set per=87 WHERE rno=2 RETURNING *;
 rno | name | per | city
-----+------+-----+------
   2 | BBB  |  87 | PUNE
(1 row)


UPDATE 1
tcadb16=# update student set per=87 WHERE rno=2 RETURNING PER,CITY;
 per | city
-----+------
  87 | PUNE
(1 row)


UPDATE 1
tcadb16=# update student set per=87 WHERE rno=29 RETURNING PER,CITY;
 per | city
-----+------
(0 rows)


UPDATE 0
tcadb16=# update student set per=87 WHERE rno=9 RETURNING PER,CITY;
 per | city
-----+------
(0 rows)


UPDATE 0
tcadb16=# drop table student;
DROP TABLE
tcadb16=# CREATE TABLE student(
tcadb16(#     rno int primary key,
tcadb16(#     name varchar(10),
tcadb16(#     per float,
tcadb16(#     city varchar(20)
tcadb16(#  );
CREATE TABLE
tcadb16=# insert into student values(1,'AAA',70,'PUNE');
INSERT 0 1
tcadb16=# insert into student values(2,'BBB',29,'PANJI');
INSERT 0 1
tcadb16=# insert into student values(3,'CCC',50,'MUMBAI');
INSERT 0 1
tcadb16=# insert into student values(4,'DDD',64,'DELHI');
INSERT 0 1
tcadb16=# insert into student values(5,'EEE',87,'BANGLORE');
INSERT 0 1
tcadb16=# insert into student values(6,'FFF',95,'PUNE');
INSERT 0 1
tcadb16=# insert into student values(7,'GGG',45,'PUNE');
INSERT 0 1
tcadb16=# insert into student values(8,'BBB',73,'DELHI');
INSERT 0 1
tcadb16=# select * from student;
 rno | name | per |   city
-----+------+-----+----------
   1 | AAA  |  70 | PUNE
   2 | BBB  |  29 | PANJI
   3 | CCC  |  50 | MUMBAI
   4 | DDD  |  64 | DELHI
   5 | EEE  |  87 | BANGLORE
   6 | FFF  |  95 | PUNE
   7 | GGG  |  45 | PUNE
   8 | BBB  |  73 | DELHI
(8 rows)


tcadb16=# update student set per = per + 5 WHERE name = 'ccc';
UPDATE 0
tcadb16=# select * from student;
 rno | name | per |   city
-----+------+-----+----------
   1 | AAA  |  70 | PUNE
   2 | BBB  |  29 | PANJI
   3 | CCC  |  50 | MUMBAI
   4 | DDD  |  64 | DELHI
   5 | EEE  |  87 | BANGLORE
   6 | FFF  |  95 | PUNE
   7 | GGG  |  45 | PUNE
   8 | BBB  |  73 | DELHI
(8 rows)


tcadb16=# update student set per = per + 5 WHERE name = 'ccc' RETURNING *;
 rno | name | per | city
-----+------+-----+------
(0 rows)


UPDATE 0
tcadb16=# update student set per = per + 5 WHERE name = 'CCC';
UPDATE 1
tcadb16=# select * from student;
 rno | name | per |   city
-----+------+-----+----------
   1 | AAA  |  70 | PUNE
   2 | BBB  |  29 | PANJI
   4 | DDD  |  64 | DELHI
   5 | EEE  |  87 | BANGLORE
   6 | FFF  |  95 | PUNE
   7 | GGG  |  45 | PUNE
   8 | BBB  |  73 | DELHI
   3 | CCC  |  55 | MUMBAI
(8 rows)


tcadb16=# update student set per = per + 5 WHERE name = 'CCC' RETURNING *;
 rno | name | per |  city
-----+------+-----+--------
   3 | CCC  |  60 | MUMBAI
(1 row)


UPDATE 1
tcadb16=# select * from student order by rno;
 rno | name | per |   city
-----+------+-----+----------
   1 | AAA  |  70 | PUNE
   2 | BBB  |  29 | PANJI
   3 | CCC  |  60 | MUMBAI
   4 | DDD  |  64 | DELHI
   5 | EEE  |  87 | BANGLORE
   6 | FFF  |  95 | PUNE
   7 | GGG  |  45 | PUNE
   8 | BBB  |  73 | DELHI
(8 rows)


tcadb16=# update student set per = per + 5 WHERE per < 40;
UPDATE 1
tcadb16=# select * from student order by rno;
 rno | name | per |   city
-----+------+-----+----------
   1 | AAA  |  70 | PUNE
   2 | BBB  |  34 | PANJI
   3 | CCC  |  60 | MUMBAI
   4 | DDD  |  64 | DELHI
   5 | EEE  |  87 | BANGLORE
   6 | FFF  |  95 | PUNE
   7 | GGG  |  45 | PUNE
   8 | BBB  |  73 | DELHI
(8 rows)


tcadb16=# DELETE FROM STUDENT WHERE RNO=2;
DELETE 1
tcadb16=# select * from student order by rno;
 rno | name | per |   city
-----+------+-----+----------
   1 | AAA  |  70 | PUNE
   3 | CCC  |  60 | MUMBAI
   4 | DDD  |  64 | DELHI
   5 | EEE  |  87 | BANGLORE
   6 | FFF  |  95 | PUNE
   7 | GGG  |  45 | PUNE
   8 | BBB  |  73 | DELHI
(7 rows)


tcadb16=# DELETE FROM STUDENT WHERE RNO=2 RETURNING *;
 rno | name | per | city
-----+------+-----+------
(0 rows)


DELETE 0
tcadb16=# DELETE FROM STUDENT WHERE RNO=6 RETURNING *;
 rno | name | per | city
-----+------+-----+------
   6 | FFF  |  95 | PUNE
(1 row)


DELETE 1
tcadb16=# select * from student order by rno;
 rno | name | per |   city
-----+------+-----+----------
   1 | AAA  |  70 | PUNE
   3 | CCC  |  60 | MUMBAI
   4 | DDD  |  64 | DELHI
   5 | EEE  |  87 | BANGLORE
   7 | GGG  |  45 | PUNE
   8 | BBB  |  73 | DELHI
(6 rows)


tcadb16=# select * from student;
 rno | name | per |   city
-----+------+-----+----------
   1 | AAA  |  70 | PUNE
   4 | DDD  |  64 | DELHI
   5 | EEE  |  87 | BANGLORE
   7 | GGG  |  45 | PUNE
   8 | BBB  |  73 | DELHI
   3 | CCC  |  60 | MUMBAI
(6 rows)


tcadb16=# insert into student(rno,name,city) values(111,'XXX','PUNE');
INSERT 0 1
tcadb16=# select * from student;
 rno | name | per |   city
-----+------+-----+----------
   1 | AAA  |  70 | PUNE
   4 | DDD  |  64 | DELHI
   5 | EEE  |  87 | BANGLORE
   7 | GGG  |  45 | PUNE
   8 | BBB  |  73 | DELHI
   3 | CCC  |  60 | MUMBAI
 111 | XXX  |     | PUNE
(7 rows)


tcadb16=# delete from student where rno=NULL
tcadb16-# delete from student where rno=NULL;
ERROR:  syntax error at or near "delete"
LINE 2: delete from student where rno=NULL;
        ^
tcadb16=# delete from student where rno=NULL;
DELETE 0
tcadb16=# select * from student;
 rno | name | per |   city
-----+------+-----+----------
   1 | AAA  |  70 | PUNE
   4 | DDD  |  64 | DELHI
   5 | EEE  |  87 | BANGLORE
   7 | GGG  |  45 | PUNE
   8 | BBB  |  73 | DELHI
   3 | CCC  |  60 | MUMBAI
 111 | XXX  |     | PUNE
(7 rows)


tcadb16=# delete from student where rno IS NULL;
DELETE 0
tcadb16=# delete from student where PER IS NULL;
DELETE 1
tcadb16=# select * from student;
 rno | name | per |   city
-----+------+-----+----------
   1 | AAA  |  70 | PUNE
   4 | DDD  |  64 | DELHI
   5 | EEE  |  87 | BANGLORE
   7 | GGG  |  45 | PUNE
   8 | BBB  |  73 | DELHI
   3 | CCC  |  60 | MUMBAI
(6 rows)


tcadb16=# DELETE FROM STUDENT WHERE city = 'MUMBAI' and per < 40;
DELETE 0
tcadb16=# select * from student;
 rno | name | per |   city
-----+------+-----+----------
   1 | AAA  |  70 | PUNE
   4 | DDD  |  64 | DELHI
   5 | EEE  |  87 | BANGLORE
   7 | GGG  |  45 | PUNE
   8 | BBB  |  73 | DELHI
   3 | CCC  |  60 | MUMBAI
(6 rows)


tcadb16=# DELETE FROM STUDENT WHERE city = 'MUMBAI' and per > 40;
DELETE 1
tcadb16=# select * from student;
 rno | name | per |   city
-----+------+-----+----------
   1 | AAA  |  70 | PUNE
   4 | DDD  |  64 | DELHI
   5 | EEE  |  87 | BANGLORE
   7 | GGG  |  45 | PUNE
   8 | BBB  |  73 | DELHI
(5 rows)


tcadb16=# DELETE FROM STUDENT;
DELETE 5
tcadb16=# select * from student;
 rno | name | per | city
-----+------+-----+------
(0 rows)


tcadb16=# drop table student;
DROP TABLE
tcadb16=# CREATE TABLE student(
tcadb16(#     rno int primary key,
tcadb16(#     name varchar(10),
tcadb16(#     per float,
tcadb16(#     city varchar(20)
tcadb16(#  );
CREATE TABLE
tcadb16=#
tcadb16=#
tcadb16=# insert into student values(1,'AAA',70,'PUNE');
INSERT 0 1
tcadb16=# insert into student values(2,'BBB',29,'PANJI');
INSERT 0 1
tcadb16=# insert into student values(3,'CCC',50,'MUMBAI');
INSERT 0 1
tcadb16=# insert into student values(4,'DDD',64,'DELHI');
INSERT 0 1
tcadb16=# insert into student values(5,'EEE',87,'BANGLORE');
INSERT 0 1
tcadb16=# insert into student values(6,'FFF',95,'PUNE');
INSERT 0 1
tcadb16=# insert into student values(7,'GGG',45,'PUNE');
INSERT 0 1
tcadb16=# insert into student values(8,'BBB',73,'DELHI');
INSERT 0 1
tcadb16=# select * from student;
 rno | name | per |   city
-----+------+-----+----------
   1 | AAA  |  70 | PUNE
   2 | BBB  |  29 | PANJI
   3 | CCC  |  50 | MUMBAI
   4 | DDD  |  64 | DELHI
   5 | EEE  |  87 | BANGLORE
   6 | FFF  |  95 | PUNE
   7 | GGG  |  45 | PUNE
   8 | BBB  |  73 | DELHI
(8 rows)


tcadb16=# TRUNCATE TABLE student;
TRUNCATE TABLE
tcadb16=# select * from student;
 rno | name | per | city
-----+------+-----+------
(0 rows)


tcadb16=# COMMIT;
WARNING:  there is no transaction in progress
COMMIT
tcadb16=#